<?xml version="1.0" encoding="UTF-8"?>
<?xml-stylesheet type="text/css" href="1.css"?>
<xs:schema xmlns:xs="http://www.w3.org/2001/XMLSchema">
    <xs:element name="groceries">
        <xs:complexType>
            <xs:sequence>
                <xs:element name="menutitle" type="xs:string"/>
                <xs:element name="product" maxOccurs="unbounded">
                    <xs:complexType>
                        <xs:sequence>
                            <xs:element name="name" type="xs:string"/>
                            <xs:element name="price" type="xs:string"/>
                            <xs:element name="delivered" type="xs:date"/>
                        </xs:sequence>
                    </xs:complexType>
                </xs:element>
            </xs:sequence>
        </xs:complexType>
    </xs:element>
</xs:schema>
